image|name|% of decks|count
https://images.ygoprodeck.com/images/cards/3410461.jpg|Alba-Lenatus the Abyss Dragon|100.00%|1.00
https://images.ygoprodeck.com/images/cards/87746184.jpg|Albion the Branded Dragon|100.00%|1.00
https://images.ygoprodeck.com/images/cards/38811586.jpg|Albion the Sanctifire Dragon|100.00%|1.00
https://images.ygoprodeck.com/images/cards/86240887.jpg|Buster Blader, the Dragon Destroyer Swordsman|100.00%|1.00
https://images.ygoprodeck.com/images/cards/11790356.jpg|Buster Dragon|100.00%|1.00
https://images.ygoprodeck.com/images/cards/22850702.jpg|Chaos Angel|100.00%|1.00
https://images.ygoprodeck.com/images/cards/62111090.jpg|Earth Golem @Ignister|100.00%|1.00
https://images.ygoprodeck.com/images/cards/11765832.jpg|Garura, Wings of Resonant Life|100.00%|1.00
https://images.ygoprodeck.com/images/cards/24361622.jpg|Hieratic Seal of the Heavenly Spheres|100.00%|1.00
https://images.ygoprodeck.com/images/cards/72578374.jpg|Khaos Starsource Dragon|100.00%|1.00
https://images.ygoprodeck.com/images/cards/70534340.jpg|Lubellion the Searing Dragon|100.00%|1.00
https://images.ygoprodeck.com/images/cards/44146295.jpg|Mirrorjade the Iceblade Dragon|100.00%|1.00
https://images.ygoprodeck.com/images/cards/54757758.jpg|Mudragon of the Swamp|100.00%|1.00
https://images.ygoprodeck.com/images/cards/42097666.jpg|Spirit with Eyes of Blue|100.00%|1.00
https://images.ygoprodeck.com/images/cards/93039339.jpg|Super Starslayer TY-PHON - Sky Crisis|100.00%|1.00
