image|name|% of decks|count
https://images.ygoprodeck.com/images/cards/88120966.jpg|Number 15: Gimmick Puppet Giant Grinder|100.00%|2.33
https://images.ygoprodeck.com/images/cards/3685372.jpg|CXyz Gimmick Puppet Fanatix Machinix|100.00%|2.00
https://images.ygoprodeck.com/images/cards/97520532.jpg|Gimmick Puppet Chimera Doll|100.00%|2.00
https://images.ygoprodeck.com/images/cards/76290637.jpg|Gimmick Puppet Fantasix Machinix|100.00%|2.00
https://images.ygoprodeck.com/images/cards/33776843.jpg|Number C15: Gimmick Puppet Giant Hunter|100.00%|2.00
https://images.ygoprodeck.com/images/cards/7593748.jpg|Gimmick Puppet Gigantes Doll|100.00%|1.00
https://images.ygoprodeck.com/images/cards/75433814.jpg|Number 40: Gimmick Puppet of Strings|100.00%|1.00
https://images.ygoprodeck.com/images/cards/69170557.jpg|Number C40: Gimmick Puppet of Dark Strings|100.00%|1.00
https://images.ygoprodeck.com/images/cards/54757758.jpg|Mudragon of the Swamp|33.30%|2.00
https://images.ygoprodeck.com/images/cards/11765832.jpg|Garura, Wings of Resonant Life|33.30%|1.00
https://images.ygoprodeck.com/images/cards/60465049.jpg|Psychic End Punisher|33.30%|1.00
https://images.ygoprodeck.com/images/cards/93039339.jpg|Super Starslayer TY-PHON - Sky Crisis|33.30%|1.00
